{
  "schema": "maqam.benchmark.performance/v1",
  "suite": {
    "name": "Maqam Governance Evaluation Suite",
    "shortName": "MGES",
    "profile": "local-call-performance",
    "version": "1.1.0",
    "authority": "Maqam project-defined microbenchmark",
    "externallyStandardized": false
  },
  "measuredAt": "2026-07-18T15:46:55.693Z",
  "executionDurationMs": 61979.885,
  "repository": {
    "available": true,
    "commit": "c58cb850daeffa24f5f088a97689f5c75c2db69b",
    "workingTreeDirty": false
  },
  "sourceFingerprint": {
    "algorithm": "sha256",
    "combined": "1b7d71c8910f7e1e3db446e28a095a630d66049fd45eeace8d38c264b7e8601e",
    "files": [
      {
        "path": "benchmarks/governance-suite.mjs",
        "sha256": "d1f0f47b1d7704a35a95c20ba7dd352e0fb2986f94c030a1b0b0ecdd7f8126dd"
      },
      {
        "path": "benchmarks/_governance-worker.mjs",
        "sha256": "ed84a1d82d0cc143229c6bd78e2eff23bf1ac33d66437df93714716cd899e386"
      },
      {
        "path": "src/framework/tool-gateway.js",
        "sha256": "2b2c39f00f7f823485c7831066eedcea1a2a4d9d74964cb4f94d1784485c7aaa"
      },
      {
        "path": "src/framework/policy.js",
        "sha256": "b4cffbf6a6d61a64b955f8640fca254f89c62394163a18ab8d5ba1290a2c246f"
      },
      {
        "path": "src/framework/audit.js",
        "sha256": "a001ec6d455f583865739751c66e22929551ea7f2362bce1f510092cc1df2b9b"
      },
      {
        "path": "src/framework/boundary.js",
        "sha256": "21dc9d5762cdf06ebf4700e059d70d19111cd81f7a7bbd18437877a78e448801"
      },
      {
        "path": "src/framework/evidence-scope.js",
        "sha256": "bee057f58dbdc491da7b37b981b09ebfc6c3b1b65c84d921d19d6c2d65f5ed8f"
      },
      {
        "path": "src/framework/errors.js",
        "sha256": "7b28d86f3050ba7f1bba2c0fa239ca334b60c470a9f05c4e7ebd90d79e5266cb"
      },
      {
        "path": "package-lock.json",
        "sha256": "ebb967b2a48ee6ac6b6ea637888cd09bf153a90e568e7a97432b208a26dfb6d1"
      }
    ]
  },
  "environment": {
    "runtime": {
      "node": "v24.15.0",
      "v8": "13.6.233.17-node.48",
      "uv": "1.51.0"
    },
    "operatingSystem": {
      "type": "Windows_NT",
      "release": "10.0.26200",
      "platform": "win32",
      "architecture": "x64"
    },
    "processor": {
      "model": "AMD Ryzen 7 4800H with Radeon Graphics",
      "logicalCpuCount": 16,
      "reportedSpeedMHz": {
        "minimum": 2895,
        "maximum": 2895
      }
    },
    "totalMemoryBytes": 16557887488,
    "timer": {
      "api": "process.hrtime.bigint",
      "unit": "nanoseconds",
      "monotonic": true
    },
    "isolation": {
      "freshProcessPerObservation": true,
      "cpuAffinityControlled": false,
      "cpuFrequencyGovernorControlled": false,
      "backgroundLoadControlled": false
    }
  },
  "methodology": {
    "samplesPerVariant": 30,
    "order": "Alternating direct/governed then governed/direct paired rounds",
    "processIsolation": "Each observation runs in a fresh child process; process startup is outside the timed interval.",
    "timing": "One timed sequential batch measured with process.hrtime.bigint().",
    "warmup": "Each child warms an independent fixture before creating the measured fixture.",
    "interval": "Deterministic percentile bootstrap interval for the sample median; it describes run-to-run sampling uncertainty on this machine, not other machines.",
    "directIterationsPerObservation": 5000000,
    "governedIterationsPerObservation": 5000,
    "directWarmupIterations": 250000,
    "governedWarmupIterations": 500,
    "bootstrapResamples": 10000
  },
  "fixture": {
    "operation": "Sequential async in-process handler returning input.value + 1",
    "input": {
      "value": 41,
      "nested": {
        "release": "0.3.x"
      }
    },
    "directPath": "Call the same handler directly.",
    "governedPath": "Call a registered tool through ToolGateway and an allowlist PolicyEngine with tracing enabled.",
    "excluded": [
      "model inference",
      "network I/O",
      "filesystem I/O",
      "durable storage",
      "human review time",
      "process startup",
      "concurrent load"
    ]
  },
  "results": {
    "direct": {
      "sampleCount": 30,
      "medianNsPerOperation": 106.547,
      "medianMicrosecondsPerOperation": 0.107,
      "meanNsPerOperation": 109.163,
      "standardDeviationNsPerOperation": 19.004,
      "coefficientOfVariation": 0.17409,
      "medianAbsoluteDeviationNsPerOperation": 9.495,
      "minimumNsPerOperation": 81.424,
      "p05SampleMeanNsPerOperation": 84.053,
      "p95SampleMeanNsPerOperation": 138.492,
      "maximumNsPerOperation": 166.126,
      "operationsPerSecondAtMedian": 9385573.435,
      "medianTimedBatchMs": 532.732,
      "bootstrapMedian95Interval": {
        "method": "deterministic-percentile-bootstrap",
        "confidenceLevel": 0.95,
        "resamples": 10000,
        "seed": "0x4d415141",
        "lowNsPerOperation": 101.241,
        "highNsPerOperation": 109.91,
        "lowMicrosecondsPerOperation": 0.101,
        "highMicrosecondsPerOperation": 0.11
      }
    },
    "governed": {
      "sampleCount": 30,
      "medianNsPerOperation": 198042.14,
      "medianMicrosecondsPerOperation": 198.042,
      "meanNsPerOperation": 209055.159,
      "standardDeviationNsPerOperation": 39976.279,
      "coefficientOfVariation": 0.191224,
      "medianAbsoluteDeviationNsPerOperation": 20740.85,
      "minimumNsPerOperation": 149535.06,
      "p05SampleMeanNsPerOperation": 166998.793,
      "p95SampleMeanNsPerOperation": 279838.088,
      "maximumNsPerOperation": 316684.42,
      "operationsPerSecondAtMedian": 5049.43,
      "medianTimedBatchMs": 990.211,
      "bootstrapMedian95Interval": {
        "method": "deterministic-percentile-bootstrap",
        "confidenceLevel": 0.95,
        "resamples": 10000,
        "seed": "0x4d415142",
        "lowNsPerOperation": 186955.02,
        "highNsPerOperation": 215213.09,
        "lowMicrosecondsPerOperation": 186.955,
        "highMicrosecondsPerOperation": 215.213
      }
    },
    "pairedAdded": {
      "sampleCount": 30,
      "medianNsPerOperation": 197938.508,
      "medianMicrosecondsPerOperation": 197.939,
      "meanNsPerOperation": 208945.995,
      "standardDeviationNsPerOperation": 39972.487,
      "coefficientOfVariation": 0.191305,
      "medianAbsoluteDeviationNsPerOperation": 20712.438,
      "minimumNsPerOperation": 149449.977,
      "p05SampleMeanNsPerOperation": 166882.595,
      "p95SampleMeanNsPerOperation": 279729.684,
      "maximumNsPerOperation": 316560.786,
      "bootstrapMedian95Interval": {
        "method": "deterministic-percentile-bootstrap",
        "confidenceLevel": 0.95,
        "resamples": 10000,
        "seed": "0x4d415143",
        "lowNsPerOperation": 186851.51,
        "highNsPerOperation": 215092.79,
        "lowMicrosecondsPerOperation": 186.852,
        "highMicrosecondsPerOperation": 215.093
      }
    }
  },
  "raw": {
    "rounds": [
      {
        "round": 1,
        "order": [
          "direct",
          "governed"
        ],
        "observations": [
          {
            "round": 1,
            "orderPosition": 1,
            "variant": "direct",
            "iterations": 5000000,
            "warmupIterations": 250000,
            "elapsedNs": 527820900,
            "nsPerOperation": 105.564,
            "operationsPerSecond": 9472910.224,
            "checksum": 210000000,
            "verification": {
              "expectedResult": 42,
              "governedTraceEntries": null,
              "governedCallCount": null,
              "iterations": 5000000
            }
          },
          {
            "round": 1,
            "orderPosition": 2,
            "variant": "governed",
            "iterations": 5000,
            "warmupIterations": 500,
            "elapsedNs": 968727300,
            "nsPerOperation": 193745.46,
            "operationsPerSecond": 5161.411,
            "checksum": 210000,
            "verification": {
              "expectedResult": 42,
              "governedTraceEntries": 5000,
              "governedCallCount": 5000,
              "iterations": 5000
            }
          }
        ]
      },
      {
        "round": 2,
        "order": [
          "governed",
          "direct"
        ],
        "observations": [
          {
            "round": 2,
            "orderPosition": 1,
            "variant": "governed",
            "iterations": 5000,
            "warmupIterations": 500,
            "elapsedNs": 1289715900,
            "nsPerOperation": 257943.18,
            "operationsPerSecond": 3876.823,
            "checksum": 210000,
            "verification": {
              "expectedResult": 42,
              "governedTraceEntries": 5000,
              "governedCallCount": 5000,
              "iterations": 5000
            }
          },
          {
            "round": 2,
            "orderPosition": 2,
            "variant": "direct",
            "iterations": 5000000,
            "warmupIterations": 250000,
            "elapsedNs": 499840100,
            "nsPerOperation": 99.968,
            "operationsPerSecond": 10003199.023,
            "checksum": 210000000,
            "verification": {
              "expectedResult": 42,
              "governedTraceEntries": null,
              "governedCallCount": null,
              "iterations": 5000000
            }
          }
        ]
      },
      {
        "round": 3,
        "order": [
          "direct",
          "governed"
        ],
        "observations": [
          {
            "round": 3,
            "orderPosition": 1,
            "variant": "direct",
            "iterations": 5000000,
            "warmupIterations": 250000,
            "elapsedNs": 502166700,
            "nsPerOperation": 100.433,
            "operationsPerSecond": 9956852.973,
            "checksum": 210000000,
            "verification": {
              "expectedResult": 42,